{
  "$schema": "https://json-schema.org/draft/2020-12/schema",
  "$id": "https://github.com/sonemeng/presentonpp-version/template-toolkit/schema.json",
  "title": "Presentation Template Metadata",
  "type": "object",
  "additionalProperties": false,
  "required": ["id", "name", "description", "layouts"],
  "properties": {
    "id": {"type": "string", "pattern": "^[a-z0-9]+(?:-[a-z0-9]+)*$", "minLength": 1},
    "name": {"type": "string", "minLength": 1},
    "description": {"type": "string", "minLength": 1},
    "tags": {"type": "array", "items": {"type": "string", "minLength": 1}, "uniqueItems": true},
    "layouts": {
      "type": "array",
      "minItems": 1,
      "items": {
        "type": "object",
        "additionalProperties": false,
        "required": ["id", "name", "purpose"],
        "properties": {
          "id": {"type": "string", "pattern": "^[a-z0-9]+(?:-[a-z0-9]+)*$", "minLength": 1},
          "name": {"type": "string", "minLength": 1},
          "purpose": {"type": "string", "minLength": 1}
        }
      }
    }
  }
}
